{
  "OFFs Brasil": [
    {
      "id": "f0c37d7c-2332-4a17-9f84-3530bce874b7",
      "title": "PULÔ PARK",
      "date": "2026-02-10T12:00:00.000Z",
      "cacheValor": "4",
      "creditsConsumedSupplier": 1,
      "costPerCreditSnapshot": "4",
      "locutor": "Billy",
      "status": "VENDA",
      "createdAt": "2026-02-18T19:08:29.270Z"
    },
    {
      "id": "95d3e81d-ee6e-45ba-95cc-2d83c52ed4da",
      "title": "JOVEM PAN SAUDE",
      "date": "2026-02-10T12:00:00.000Z",
      "cacheValor": "4",
      "creditsConsumedSupplier": 1,
      "costPerCreditSnapshot": "4",
      "locutor": "Edu",
      "status": "VENDA",
      "createdAt": "2026-02-18T19:08:03.792Z"
    },
    {
      "id": "c08ec397-ce61-4594-91ec-7aed87cb9864",
      "title": "URA GENESYS LOGA - 13/02/2026",
      "date": "2026-02-13T12:00:00.000Z",
      "cacheValor": "24",
      "creditsConsumedSupplier": 6,
      "costPerCreditSnapshot": "4",
      "locutor": "Liddy",
      "status": "PEDIDO",
      "createdAt": "2026-02-13T14:25:46.378Z"
    },
    {
      "id": "7b7d3da9-fcf9-4076-a47a-22ca50bd9d60",
      "title": "FRASE SLOGAN - OLHA NO FOLHA VITORIA - 12-02-2026",
      "date": "2026-02-12T12:00:00.000Z",
      "cacheValor": "4",
      "creditsConsumedSupplier": 1,
      "costPerCreditSnapshot": "4",
      "locutor": "Duda",
      "status": "VENDA",
      "createdAt": "2026-02-12T12:52:29.160Z"
    },
    {
      "id": "c186a085-ceb4-4131-a506-0377d19224f2",
      "title": "AMORSAUDE LINHARES 30 - 12-02-2026",
      "date": "2026-02-12T12:00:00.000Z",
      "cacheValor": "4",
      "creditsConsumedSupplier": 1,
      "costPerCreditSnapshot": "4",
      "locutor": "Pablo Siqueira",
      "status": "VENDA",
      "createdAt": "2026-02-12T12:09:01.987Z"
    },
    {
      "id": "6dc15e99-beaa-43f6-aa05-f9ae8499e16b",
      "title": "DIA DO REPORTER - 12-02-2026",
      "date": "2026-02-12T12:00:00.000Z",
      "cacheValor": "4",
      "creditsConsumedSupplier": 1,
      "costPerCreditSnapshot": "4",
      "locutor": "Duda",
      "status": "VENDA",
      "createdAt": "2026-02-12T12:08:03.267Z"
    },
    {
      "id": "ce6d36ba-0fed-429d-a4b7-11d3c31c786c",
      "title": "HOSPITAL POLICLINICA UNIMED - 12-02-2026",
      "date": "2026-02-12T12:00:00.000Z",
      "cacheValor": "8",
      "creditsConsumedSupplier": 2,
      "costPerCreditSnapshot": "4",
      "locutor": "Paulo",
      "status": "VENDA",
      "createdAt": "2026-02-12T11:57:33.988Z"
    },
    {
      "id": "524586fb-4f41-4c7b-a352-8a2c03aa194b",
      "title": "FESTIVAL DO BEBE TRAJANO SPOT 30 - 11-02-2026",
      "date": "2026-02-11T12:00:00.000Z",
      "cacheValor": "4",
      "creditsConsumedSupplier": 1,
      "costPerCreditSnapshot": "4",
      "locutor": "Ana",
      "status": "VENDA",
      "createdAt": "2026-02-11T14:19:30.925Z"
    },
    {
      "id": "6d76ead4-57a2-4781-aa60-df61e7f078b8",
      "title": "VILELAS SUPERMERCADOS",
      "date": "2026-02-03T15:00:00.000Z",
      "cacheValor": "4",
      "creditsConsumedSupplier": 1,
      "costPerCreditSnapshot": "4",
      "locutor": "Wanderson",
      "status": "VENDA",
      "createdAt": "2026-02-09T15:37:17.057Z"
    },
    {
      "id": "1d6fef3c-2e87-4c87-b50c-5130c3c23313",
      "title": "CARNAVAL DE OPORTUNIDADES CVC CHEVROLET 30 - 04-02-2026",
      "date": "2026-02-04T00:00:00.000Z",
      "cacheValor": "4",
      "creditsConsumedSupplier": 0,
      "costPerCreditSnapshot": "4",
      "locutor": "Lucas",
      "status": "VENDA",
      "createdAt": "2026-02-04T19:17:14.330Z"
    },
    {
      "id": "baf2b19e-e4c4-4599-84c9-f1612ad63ec6",
      "title": "CARNAVAL DADALTO CASA SÃO MATEUS - 04-02-2026",
      "date": "2026-02-04T19:11:57.498Z",
      "cacheValor": "8",
      "creditsConsumedSupplier": 0,
      "costPerCreditSnapshot": "4",
      "locutor": "Nick",
      "status": "VENDA",
      "createdAt": "2026-02-04T19:11:57.498Z"
    },
    {
      "id": "473d8a3a-50fc-4319-a63b-59e380981ba5",
      "title": "SENDWAVE",
      "date": "2026-02-03T00:00:00.000Z",
      "cacheValor": "4",
      "creditsConsumedSupplier": 0,
      "costPerCreditSnapshot": "4",
      "locutor": "Renato",
      "status": "ENTREGUE",
      "createdAt": "2026-02-04T15:56:19.596Z"
    },
    {
      "id": "465a563a-d462-4b98-b74d-ce1945fccf2b",
      "title": "DIA NACIONAL DA MAMOGRAFIA - 04-02-2026",
      "date": "2026-02-04T00:00:00.000Z",
      "cacheValor": "4",
      "creditsConsumedSupplier": 0,
      "costPerCreditSnapshot": "4",
      "locutor": "Duda",
      "status": "VENDA",
      "createdAt": "2026-02-04T13:25:27.876Z"
    },
    {
      "id": "7f28b107-d4a8-400d-b65f-58c8683aeddc",
      "title": "VILELAS SUPERMERCADOS",
      "date": "2026-02-03T00:00:00.000Z",
      "cacheValor": "4",
      "creditsConsumedSupplier": 0,
      "costPerCreditSnapshot": "4",
      "locutor": "Wanderson",
      "status": "ENTREGUE",
      "createdAt": "2026-02-03T21:15:52.502Z"
    },
    {
      "id": "d522d5a7-600b-499a-aa50-f25301c926f8",
      "title": "TIME COMERCIAL - 03-02-2026",
      "date": "2026-02-02T12:00:00.000Z",
      "cacheValor": "12",
      "creditsConsumedSupplier": 3,
      "costPerCreditSnapshot": "4",
      "locutor": "Liddy",
      "status": "VENDA",
      "createdAt": "2026-02-03T19:02:12.703Z"
    },
    {
      "id": "0429b686-46f9-41dc-8f6a-a2d75e5e4871",
      "title": "BLOCO DAS VANTAGENS TAI MOTORS 30 - 03-02-2026",
      "date": "2026-02-03T18:10:14.651Z",
      "cacheValor": "4",
      "creditsConsumedSupplier": 0,
      "costPerCreditSnapshot": "4",
      "locutor": "Nick",
      "status": "VENDA",
      "createdAt": "2026-02-03T18:10:14.651Z"
    },
    {
      "id": "539b8d9f-b920-4030-8c9e-c832cf620600",
      "title": "IPTU 2026 BALNEARIO PIÇARRAS SPOT 30 - 02-02-2026",
      "date": "2026-02-02T12:53:26.485Z",
      "cacheValor": "4",
      "creditsConsumedSupplier": 0,
      "costPerCreditSnapshot": "4",
      "locutor": "Paulo",
      "status": "VENDA",
      "createdAt": "2026-02-02T12:53:26.485Z"
    },
    {
      "id": "b72c927a-4bc8-47e1-af1c-a83f4cad4f61",
      "title": "VERÃO DE TANQUE CHEIO TRAJANO SPOT 30 B - 29-01-2026",
      "date": "2026-01-30T15:00:00.000Z",
      "cacheValor": "4",
      "creditsConsumedSupplier": 1,
      "costPerCreditSnapshot": "4",
      "locutor": "Ana",
      "status": "VENDA",
      "createdAt": "2026-01-30T12:32:11.887Z"
    },
    {
      "id": "c3877b8e-a9ae-4718-bfca-11a4154784c0",
      "title": "OFERTAS EXTRA POPULAR FEVEREIRO 15 03 - 26-01-2026",
      "date": "2026-01-26T13:06:26.354Z",
      "cacheValor": "4",
      "creditsConsumedSupplier": 0,
      "costPerCreditSnapshot": "4",
      "locutor": "Duda",
      "status": "VENDA",
      "createdAt": "2026-01-26T13:06:26.354Z"
    },
    {
      "id": "a1fc52b0-633e-46a5-a2a3-d5af61fb5c0f",
      "title": "OFERTAS EXTRA POPULAR FEVEREIRO 15 02 - 26-01-2026",
      "date": "2026-01-26T13:06:25.062Z",
      "cacheValor": "4",
      "creditsConsumedSupplier": 0,
      "costPerCreditSnapshot": "4",
      "locutor": "Duda",
      "status": "VENDA",
      "createdAt": "2026-01-26T13:06:25.062Z"
    }
  ],
  "Locução Brasil": [
    {
      "id": "f9f2df51-f6b9-409b-a250-b793bdbe138d",
      "title": "CARTÃO DE TODOS V2",
      "date": "2026-02-19T12:00:00.000Z",
      "cacheValor": "3.5",
      "creditsConsumedSupplier": 1,
      "costPerCreditSnapshot": "3.5",
      "locutor": "Erick",
      "status": "PEDIDO",
      "createdAt": "2026-02-19T12:39:06.101Z"
    },
    {
      "id": "f7735ebd-b1b9-4085-9e25-8b9644fa91bc",
      "title": "GAC LIDER VILA VELHA - 18/02/2026",
      "date": "2026-02-18T12:00:00.000Z",
      "cacheValor": "20",
      "creditsConsumedSupplier": 1,
      "costPerCreditSnapshot": null,
      "locutor": "Vini",
      "status": "VENDA",
      "createdAt": "2026-02-18T20:54:51.778Z"
    },
    {
      "id": "a8187f79-6af8-469b-a2f9-c0ef6f053e66",
      "title": "ENCONTRE-SE NO ESPIRITO SANTO - 11-02-2026",
      "date": "2026-02-11T12:00:00.000Z",
      "cacheValor": "7",
      "creditsConsumedSupplier": 2,
      "costPerCreditSnapshot": "3.5",
      "locutor": "Iza",
      "status": "VENDA",
      "createdAt": "2026-02-12T12:21:57.996Z"
    },
    {
      "id": "55afb0cb-7353-425d-97ab-0e91cc9ea60e",
      "title": "CARTÃO DE TODOS 30 - 11-02-2026",
      "date": "2026-02-11T12:00:00.000Z",
      "cacheValor": "3.5",
      "creditsConsumedSupplier": 1,
      "costPerCreditSnapshot": "3.5",
      "locutor": "Erick",
      "status": "VENDA",
      "createdAt": "2026-02-11T14:05:37.040Z"
    },
    {
      "id": "c154c8f5-9887-434b-88df-07bab006460b",
      "title": "TOYOTA RAMIRES 15 - 10-02-2026",
      "date": "2026-02-10T12:00:00.000Z",
      "cacheValor": "3.5",
      "creditsConsumedSupplier": 1,
      "costPerCreditSnapshot": "3.5",
      "locutor": "Erick",
      "status": "VENDA",
      "createdAt": "2026-02-10T12:30:55.686Z"
    },
    {
      "id": "f60cc5b5-9695-44af-981d-bf883e5b6c61",
      "title": "ARANÃO TRANSPORTES E NECTA GÁS NATURAL - 10-02-2026",
      "date": "2026-02-10T12:00:00.000Z",
      "cacheValor": "7",
      "creditsConsumedSupplier": 2,
      "costPerCreditSnapshot": "3.5",
      "locutor": "Liddy",
      "status": "VENDA",
      "createdAt": "2026-02-10T12:29:55.827Z"
    },
    {
      "id": "1a8fbe59-9890-4d00-929c-13483ecc8275",
      "title": "OFERTA MERCEDES GLA 200 AMG LINE 2026 - 06-02-2026",
      "date": "2026-02-06T15:00:00.000Z",
      "cacheValor": "3.5",
      "creditsConsumedSupplier": 1,
      "costPerCreditSnapshot": "3.5",
      "locutor": "Liddy",
      "status": "VENDA",
      "createdAt": "2026-02-06T15:02:16.064Z"
    },
    {
      "id": "de853b38-0a78-4d31-befd-42d1f2faa81f",
      "title": "MAQFORTE",
      "date": "2026-02-06T15:00:00.000Z",
      "cacheValor": "3.5",
      "creditsConsumedSupplier": 1,
      "costPerCreditSnapshot": "3.5",
      "locutor": "Paulo",
      "status": "ENTREGUE",
      "createdAt": "2026-02-06T12:14:52.939Z"
    },
    {
      "id": "2b2d1792-adde-468a-bfd4-ac32d5763d9b",
      "title": "CARNAVAL SÓGI",
      "date": "2026-02-03T00:00:00.000Z",
      "cacheValor": "7",
      "creditsConsumedSupplier": 2,
      "costPerCreditSnapshot": "3.5",
      "locutor": "Nick",
      "status": "ENTREGUE",
      "createdAt": "2026-02-06T12:07:02.882Z"
    },
    {
      "id": "e9d9daaa-6273-456b-95fd-813cb5914d8e",
      "title": "INDIANA JUIZ DE FORA - EM FUNCIONAMENTO_iza)",
      "date": "2026-01-20T12:00:00.000Z",
      "cacheValor": "3.5",
      "creditsConsumedSupplier": 1,
      "costPerCreditSnapshot": null,
      "locutor": "Iza",
      "status": "ENTREGUE",
      "createdAt": "2026-02-05T13:55:42.666Z"
    },
    {
      "id": "d947fbc2-216d-4223-bc19-d8bea45009c8",
      "title": "INDIANA JUIZ DE FORA - É HOJE_iza)",
      "date": "2026-01-20T12:00:00.000Z",
      "cacheValor": "3.5",
      "creditsConsumedSupplier": 1,
      "costPerCreditSnapshot": null,
      "locutor": "Iza",
      "status": "ENTREGUE",
      "createdAt": "2026-02-05T13:55:42.660Z"
    },
    {
      "id": "26851926-33bd-4190-a07b-0e65c1e3f7d0",
      "title": "INDIANA JUIZ DE FORA - É AMANHA_iza)",
      "date": "2026-01-20T12:00:00.000Z",
      "cacheValor": "3.5",
      "creditsConsumedSupplier": 1,
      "costPerCreditSnapshot": null,
      "locutor": "Iza",
      "status": "ENTREGUE",
      "createdAt": "2026-02-05T13:55:42.653Z"
    },
    {
      "id": "b3ad720e-bf5a-4198-b11f-8def3966ac07",
      "title": "INDIANA JUIZ DE FORA - VEM AI COM DATA_iza)",
      "date": "2026-01-20T12:00:00.000Z",
      "cacheValor": "3.5",
      "creditsConsumedSupplier": 1,
      "costPerCreditSnapshot": null,
      "locutor": "Iza",
      "status": "ENTREGUE",
      "createdAt": "2026-02-05T13:55:42.645Z"
    },
    {
      "id": "8ac175ed-198b-429f-a22c-6d081b387973",
      "title": "INDIANA JUIZ DE FORA - VEM AI SEM DATA_iza)",
      "date": "2026-01-20T12:00:00.000Z",
      "cacheValor": "3.5",
      "creditsConsumedSupplier": 1,
      "costPerCreditSnapshot": null,
      "locutor": "Iza",
      "status": "ENTREGUE",
      "createdAt": "2026-02-05T13:55:42.638Z"
    },
    {
      "id": "d8bd4dbf-33aa-49f8-926b-4376a407011a",
      "title": "INDIANA RECRUTA BAHIA_iza)",
      "date": "2026-01-11T12:00:00.000Z",
      "cacheValor": "3.5",
      "creditsConsumedSupplier": 1,
      "costPerCreditSnapshot": null,
      "locutor": "Iza",
      "status": "ENTREGUE",
      "createdAt": "2026-02-05T13:52:52.616Z"
    },
    {
      "id": "dc0400f6-b3cb-4fd0-aaab-7e0e6314b270",
      "title": "INDIANA RECRUTA ESPIRITO SANTO_iza)",
      "date": "2026-01-11T12:00:00.000Z",
      "cacheValor": "3.5",
      "creditsConsumedSupplier": 1,
      "costPerCreditSnapshot": null,
      "locutor": "Iza",
      "status": "ENTREGUE",
      "createdAt": "2026-02-05T13:52:52.609Z"
    },
    {
      "id": "db56f21a-0b05-4978-a98a-a07d74512f51",
      "title": "INDIANA RECRUTA MINAS GERAIS_iza)",
      "date": "2026-01-11T12:00:00.000Z",
      "cacheValor": "3.5",
      "creditsConsumedSupplier": 1,
      "costPerCreditSnapshot": null,
      "locutor": "Iza",
      "status": "ENTREGUE",
      "createdAt": "2026-02-05T13:52:52.601Z"
    },
    {
      "id": "4651e229-e070-4cb3-89f0-ee9f5d0464bc",
      "title": "CONVENIO EMPRESARIAL INDIANA_iza)",
      "date": "2026-01-11T12:00:00.000Z",
      "cacheValor": "3.5",
      "creditsConsumedSupplier": 1,
      "costPerCreditSnapshot": null,
      "locutor": "Iza",
      "status": "ENTREGUE",
      "createdAt": "2026-02-05T13:52:52.593Z"
    },
    {
      "id": "1899c9d8-12b5-4ccc-aa0d-a344695ba26f",
      "title": "FOLIA BP SPOT 30 - 04-02-2026",
      "date": "2026-02-04T21:04:51.765Z",
      "cacheValor": "3.5",
      "creditsConsumedSupplier": 0,
      "costPerCreditSnapshot": "3.5",
      "locutor": "Paulo",
      "status": "VENDA",
      "createdAt": "2026-02-04T21:04:51.765Z"
    },
    {
      "id": "bab8fa5d-1ea5-4141-9548-daaabcb8db97",
      "title": "CIESP/FIESP",
      "date": "2026-02-04T12:00:00.000Z",
      "cacheValor": "14",
      "creditsConsumedSupplier": 4,
      "costPerCreditSnapshot": "3.5",
      "locutor": "Liddy",
      "status": "VENDA",
      "createdAt": "2026-02-04T16:53:36.625Z"
    }
  ]
}